number,value,datetime_start,datetime_complete,duration,params_base_filters,params_batch_size,params_dropout,params_img_size,params_lr,params_optimizer,params_scheduler,params_weight_decay,state
0,0.4135192930698395,2026-08-04 00:28:46.836629,2026-08-04 00:32:34.937117,0 days 00:03:48.100488,16,16,0.4464704583099741,224,0.0001329291894316216,adamw,cosine,2.9380279387035354e-06,COMPLETE
1,0.21599841117858887,2026-08-04 00:32:34.958365,2026-08-04 00:37:45.691317,0 days 00:05:10.732952,16,64,0.15579754426081674,256,3.511356313970405e-05,sgd,cosine,1.9762189340280066e-05,COMPLETE
2,0.24584943056106567,2026-08-04 00:37:45.707006,2026-08-04 00:56:51.815664,0 days 00:19:06.108658,48,32,0.4233589392465845,256,0.0005987474910461401,sgd,cosine,1.5673095467235414e-06,COMPLETE
3,0.34188520908355713,2026-08-04 00:56:51.831796,2026-08-04 01:07:32.294477,0 days 00:10:40.462681,48,16,0.17394178221021084,192,1.2681352169084594e-05,sgd,cosine,8.61257919259488e-06,COMPLETE
4,0.19313602149486542,2026-08-04 01:07:32.313887,2026-08-04 01:22:48.322697,0 days 00:15:16.008810,48,64,0.2427013306774357,224,1.8427970406864546e-05,sgd,cosine,1.4656553886225336e-05,COMPLETE
5,0.5951752662658691,2026-08-04 01:22:48.338876,2026-08-04 01:27:57.563974,0 days 00:05:09.225098,16,64,0.12961786069363615,256,0.0020736445177905022,sgd,cosine,0.00013199942261535007,COMPLETE
6,0.5145357847213745,2026-08-04 01:27:57.583075,2026-08-04 01:37:58.323476,0 days 00:10:00.740401,32,32,0.38529791488919807,256,8.569331925053983e-05,adamw,cosine,0.0004588156549160974,COMPLETE
7,0.0931113064289093,2026-08-04 01:37:58.339998,2026-08-04 01:38:49.376946,0 days 00:00:51.036948,32,64,0.19971689165954998,224,1.1919481947918725e-05,sgd,cosine,8.771380343280564e-06,PRUNED
8,0.5198505520820618,2026-08-04 01:38:49.390181,2026-08-04 01:54:03.604522,0 days 00:15:14.214341,48,64,0.31573689676626027,224,0.006153085601625313,sgd,cosine,0.0002576417442523316,COMPLETE
9,0.4172514081001282,2026-08-04 01:54:03.624355,2026-08-04 02:04:36.623942,0 days 00:10:32.999587,48,16,0.2350460685614512,192,0.00284475125551182,adamw,cosine,1.7874463256238412e-05,COMPLETE
10,0.6931139230728149,2026-08-04 02:04:36.644470,2026-08-04 02:09:47.551402,0 days 00:05:10.906932,16,64,0.10844535393552791,256,0.0008046987228219532,adamw,cosine,0.00012256131445687298,COMPLETE
11,0.615257978439331,2026-08-04 02:09:47.571252,2026-08-04 02:14:59.031499,0 days 00:05:11.460247,16,64,0.10233992212865979,256,0.0008201915027201746,adamw,cosine,0.00010565210604656706,COMPLETE
12,0.7572134733200073,2026-08-04 02:14:59.047904,2026-08-04 02:20:09.929426,0 days 00:05:10.881522,16,64,0.10174409430044837,256,0.00048641306190326473,adamw,cosine,7.976225717306096e-05,COMPLETE
13,0.738005518913269,2026-08-04 02:20:09.947465,2026-08-04 02:25:21.327452,0 days 00:05:11.379987,16,64,0.11343435397378887,256,0.00038312163647116824,adamw,cosine,6.39535676735501e-05,COMPLETE
14,0.5899046659469604,2026-08-04 02:25:21.343775,2026-08-04 02:30:33.764420,0 days 00:05:12.420645,16,64,0.21278148546196676,256,0.00023666483062670949,adamw,cosine,4.932987762056126e-05,COMPLETE
15,0.05859990045428276,2026-08-04 02:30:33.781790,2026-08-04 02:31:03.071602,0 days 00:00:29.289812,16,32,0.49840679574448543,256,0.0002904591667572066,adamw,cosine,0.0007870708682262808,PRUNED
16,0.21042472124099731,2026-08-04 02:31:03.085212,2026-08-04 02:31:39.861228,0 days 00:00:36.776016,32,64,0.2778557293160495,192,5.3334643889906814e-05,adamw,cosine,6.805942916525838e-05,PRUNED
17,0.6495404243469238,2026-08-04 02:31:39.874355,2026-08-04 02:36:51.709252,0 days 00:05:11.834897,16,64,0.15372408966499604,256,0.00034431206098509387,adamw,cosine,4.1381311673040386e-05,COMPLETE
18,0.39136505126953125,2026-08-04 02:36:51.725212,2026-08-04 02:38:16.877858,0 days 00:01:25.152646,16,16,0.10020626095752908,256,0.0015980879698936801,adamw,cosine,0.0003323621618577022,PRUNED
19,0.5647258162498474,2026-08-04 02:38:16.891299,2026-08-04 02:41:24.195961,0 days 00:03:07.304662,16,32,0.17333661773213113,192,0.00014836026521751637,adamw,cosine,2.980982206130852e-05,COMPLETE
20,0.06352605670690536,2026-08-04 02:41:24.211921,2026-08-04 02:42:26.629231,0 days 00:01:02.417310,32,64,0.3062387711093748,256,0.009794038281991286,adamw,cosine,0.00021601341885849374,PRUNED
21,0.7837128043174744,2026-08-04 02:42:26.643086,2026-08-04 02:47:39.178795,0 days 00:05:12.535709,16,64,0.122961235592287,256,0.0006704752554012266,adamw,cosine,0.00011670611928376237,COMPLETE
22,0.7259244918823242,2026-08-04 02:47:39.196564,2026-08-04 02:52:51.148289,0 days 00:05:11.951725,16,64,0.1390514611350892,256,0.0005912148514718079,adamw,cosine,7.043357235296238e-05,COMPLETE
23,0.30978792905807495,2026-08-04 02:52:51.164270,2026-08-04 02:53:22.340986,0 days 00:00:31.176716,16,64,0.19200353038650803,256,0.0014728763770379166,adamw,cosine,0.00015226910253398465,PRUNED
24,0.7190933227539062,2026-08-04 02:53:22.354838,2026-08-04 02:58:34.499983,0 days 00:05:12.145145,16,64,0.13591168705054943,256,0.00041788673982756137,adamw,cosine,0.0007087934389620716,COMPLETE
25,0.32826533913612366,2026-08-04 02:58:34.516024,2026-08-04 02:59:05.831574,0 days 00:00:31.315550,16,64,0.12538570470411678,256,0.00017935640335537453,adamw,cosine,8.228244134813978e-05,PRUNED
26,0.3088783025741577,2026-08-04 02:59:05.845452,2026-08-04 02:59:36.868273,0 days 00:00:31.022821,16,64,0.1730740194523755,256,0.0032436327809894482,adamw,cosine,4.4541661598471956e-05,PRUNED
27,0.6683422923088074,2026-08-04 02:59:36.881583,2026-08-04 03:04:46.407435,0 days 00:05:09.525852,16,64,0.2223735992473037,256,0.0010098378149062575,adamw,cosine,2.837296709310837e-05,COMPLETE
28,0.7395426034927368,2026-08-04 03:04:46.423520,2026-08-04 03:12:26.095772,0 days 00:07:39.672252,32,16,0.15472482137105437,224,0.0004456250818980064,adamw,cosine,0.00018961564489269168,COMPLETE
29,0.3221675753593445,2026-08-04 03:12:26.115436,2026-08-04 03:13:12.332813,0 days 00:00:46.217377,32,16,0.25044929619200623,224,7.631790577813976e-05,adamw,cosine,0.00041718758668017413,PRUNED
