number,value,datetime_start,datetime_complete,duration,params_base_filters,params_batch_size,params_dropout,params_img_size,params_lr,params_optimizer,params_scheduler,params_weight_decay,state
0,0.3810526430606842,2026-07-31 22:46:35.610428,2026-07-31 22:50:39.934184,0 days 00:04:04.323756,16,16,0.4464704583099741,224,0.0001329291894316216,adamw,cosine,2.9380279387035354e-06,COMPLETE
1,0.15333256125450134,2026-07-31 22:50:39.963633,2026-07-31 22:56:04.069264,0 days 00:05:24.105631,16,64,0.15579754426081674,256,3.511356313970405e-05,sgd,cosine,1.9762189340280066e-05,COMPLETE
2,0.31442177295684814,2026-07-31 22:56:04.089880,2026-07-31 23:15:05.463353,0 days 00:19:01.373473,48,32,0.4233589392465845,256,0.0005987474910461401,sgd,cosine,1.5673095467235414e-06,COMPLETE
3,0.2852715253829956,2026-07-31 23:15:05.485292,2026-07-31 23:25:46.990353,0 days 00:10:41.505061,48,16,0.17394178221021084,192,1.2681352169084594e-05,sgd,cosine,8.61257919259488e-06,COMPLETE
4,0.15966127812862396,2026-07-31 23:25:47.020559,2026-07-31 23:41:07.720706,0 days 00:15:20.700147,48,64,0.2427013306774357,224,1.8427970406864546e-05,sgd,cosine,1.4656553886225336e-05,COMPLETE
5,0.617702305316925,2026-07-31 23:41:07.739913,2026-07-31 23:46:30.531835,0 days 00:05:22.791922,16,64,0.12961786069363615,256,0.0020736445177905022,sgd,cosine,0.00013199942261535007,COMPLETE
6,0.4809749722480774,2026-07-31 23:46:30.555842,2026-07-31 23:56:38.578944,0 days 00:10:08.023102,32,32,0.38529791488919807,256,8.569331925053983e-05,adamw,cosine,0.0004588156549160974,COMPLETE
7,0.07064234465360641,2026-07-31 23:56:38.599616,2026-07-31 23:57:29.070590,0 days 00:00:50.470974,32,64,0.19971689165954998,224,1.1919481947918725e-05,sgd,cosine,8.771380343280564e-06,PRUNED
8,0.4658326208591461,2026-07-31 23:57:29.088310,2026-08-01 00:12:45.493582,0 days 00:15:16.405272,48,64,0.31573689676626027,224,0.006153085601625313,sgd,cosine,0.0002576417442523316,COMPLETE
9,0.3510363698005676,2026-08-01 00:12:45.513370,2026-08-01 00:23:14.290153,0 days 00:10:28.776783,48,16,0.2350460685614512,192,0.00284475125551182,adamw,cosine,1.7874463256238412e-05,COMPLETE
10,0.6649636030197144,2026-08-01 00:23:14.311789,2026-08-01 00:28:37.414757,0 days 00:05:23.102968,16,64,0.10844535393552791,256,0.0008046987228219532,adamw,cosine,0.00012256131445687298,COMPLETE
11,0.6707873940467834,2026-08-01 00:28:37.437802,2026-08-01 00:34:01.673262,0 days 00:05:24.235460,16,64,0.10233992212865979,256,0.0008201915027201746,adamw,cosine,0.00010565210604656706,COMPLETE
12,0.7284326553344727,2026-08-01 00:34:01.696250,2026-08-01 00:39:27.524201,0 days 00:05:25.827951,16,64,0.10174409430044837,256,0.00048641306190326473,adamw,cosine,7.976225717306096e-05,COMPLETE
13,0.62088942527771,2026-08-01 00:39:27.547903,2026-08-01 00:44:52.844512,0 days 00:05:25.296609,16,64,0.11343435397378887,256,0.00038312163647116824,adamw,cosine,6.39535676735501e-05,COMPLETE
14,0.5718477964401245,2026-08-01 00:44:52.865625,2026-08-01 00:50:19.239278,0 days 00:05:26.373653,16,64,0.21308713531697668,256,0.00025321759794196517,adamw,cosine,0.0009956055660659037,COMPLETE
15,0.4976617693901062,2026-08-01 00:50:19.260044,2026-08-01 00:55:18.117269,0 days 00:04:58.857225,16,32,0.10066457810067844,256,0.0015616144167486243,adamw,cosine,4.742814284604411e-05,COMPLETE
16,0.5756171941757202,2026-08-01 00:55:18.136807,2026-08-01 01:01:29.506583,0 days 00:06:11.369776,32,64,0.2703976185065889,192,0.00017604344110565298,adamw,cosine,3.8355458626461015e-05,COMPLETE
17,0.6060812473297119,2026-08-01 01:01:29.526767,2026-08-01 01:06:51.219549,0 days 00:05:21.692782,16,64,0.1646268716454123,256,0.0010959901810935213,adamw,cosine,0.00017216005446373995,COMPLETE
18,0.2561042308807373,2026-08-01 01:06:51.239901,2026-08-01 01:07:20.225889,0 days 00:00:28.985988,16,16,0.3227853046046714,256,0.006695589843930908,adamw,cosine,0.0003323621618577022,PRUNED
19,0.36321932077407837,2026-08-01 01:07:20.241339,2026-08-01 01:08:01.369443,0 days 00:00:41.128104,16,32,0.15180735457184025,192,6.676653636204394e-05,adamw,cosine,7.516850513426533e-05,PRUNED
20,0.631675124168396,2026-08-01 01:08:01.386331,2026-08-01 01:18:48.765503,0 days 00:10:47.379172,32,64,0.1932344747175054,256,0.0005261001220107529,adamw,cosine,0.0009686975272822305,COMPLETE
21,0.681708574295044,2026-08-01 01:18:48.783673,2026-08-01 01:24:05.874596,0 days 00:05:17.090923,16,64,0.10065082410500129,256,0.000838489010421417,adamw,cosine,0.00014162072234201266,COMPLETE
22,0.24009138345718384,2026-08-01 01:24:05.892758,2026-08-01 01:24:37.375864,0 days 00:00:31.483106,16,64,0.13749670038066036,256,0.003619718272831583,adamw,cosine,0.00010316409589324508,PRUNED
23,0.7050318121910095,2026-08-01 01:24:37.391445,2026-08-01 01:29:58.428398,0 days 00:05:21.036953,16,64,0.12791652115967087,256,0.00030603556620727195,adamw,cosine,3.5153453127536294e-05,COMPLETE
24,0.6800255179405212,2026-08-01 01:29:58.447375,2026-08-01 01:35:17.989918,0 days 00:05:19.542543,16,64,0.13796855456296606,256,0.0002949842158543537,adamw,cosine,2.9922764677946163e-05,COMPLETE
25,0.3132682144641876,2026-08-01 01:35:18.009567,2026-08-01 01:35:50.051881,0 days 00:00:32.042314,16,64,0.1802407359630315,256,0.00017230123864555284,adamw,cosine,0.00024227585763435852,PRUNED
26,0.13449737429618835,2026-08-01 01:35:50.068554,2026-08-01 01:36:22.069524,0 days 00:00:32.000970,16,64,0.48815192196072205,256,0.0004218597295424999,adamw,cosine,5.273795475979241e-06,PRUNED
27,0.5770370960235596,2026-08-01 01:36:22.091749,2026-08-01 01:41:38.577498,0 days 00:05:16.485749,16,64,0.1355069477881522,256,0.0012161928534818805,adamw,cosine,5.958501246716484e-05,COMPLETE
28,0.59809410572052,2026-08-01 01:41:38.594389,2026-08-01 01:49:20.284588,0 days 00:07:41.690199,32,16,0.22144727758979907,224,0.00010047308129461447,adamw,cosine,2.8923912654089595e-05,COMPLETE
29,0.3167230486869812,2026-08-01 01:49:20.304034,2026-08-01 01:49:39.458662,0 days 00:00:19.154628,16,32,0.2676285212100534,192,0.0002460669825170237,adamw,cosine,0.00041718758668017413,PRUNED
