number,value,datetime_start,datetime_complete,duration,params_arch,params_batch_size,params_dropout,params_img_size,params_lr,params_optimizer,params_scheduler,params_weight_decay,state
0,0.9342410564422607,2026-08-01 02:03:28.624800,2026-08-01 02:08:50.634408,0 days 00:05:22.009608,resnet50,16,0.4464704583099741,224,0.0001329291894316216,adamw,cosine,2.9380279387035354e-06,COMPLETE
1,0.33158040046691895,2026-08-01 02:08:50.657903,2026-08-01 02:15:08.273939,0 days 00:06:17.616036,resnet50,64,0.15579754426081674,256,3.511356313970405e-05,sgd,cosine,1.9762189340280066e-05,COMPLETE
2,0.9139498472213745,2026-08-01 02:15:08.293953,2026-08-01 02:22:45.196897,0 days 00:07:36.902944,convnext_tiny,32,0.4233589392465845,256,0.0005987474910461401,sgd,cosine,1.5673095467235414e-06,COMPLETE
3,0.7046347856521606,2026-08-01 02:22:45.214727,2026-08-01 02:28:00.367536,0 days 00:05:15.152809,convnext_tiny,16,0.17394178221021084,192,1.2681352169084594e-05,sgd,cosine,8.61257919259488e-06,COMPLETE
4,0.5368342399597168,2026-08-01 02:28:00.385562,2026-08-01 02:34:25.788162,0 days 00:06:25.402600,convnext_tiny,64,0.2427013306774357,224,1.8427970406864546e-05,sgd,cosine,1.4656553886225336e-05,COMPLETE
5,0.8667515516281128,2026-08-01 02:34:25.808796,2026-08-01 02:40:51.934928,0 days 00:06:26.126132,resnet50,64,0.12961786069363615,256,0.0020736445177905022,sgd,cosine,0.00013199942261535007,COMPLETE
6,0.9218177199363708,2026-08-01 02:40:51.956382,2026-08-01 02:46:12.723585,0 days 00:05:20.767203,efficientnet_b0,32,0.38529791488919807,256,8.569331925053983e-05,adamw,cosine,0.0004588156549160974,COMPLETE
7,0.19868963956832886,2026-08-01 02:46:12.742973,2026-08-01 02:46:58.642342,0 days 00:00:45.899369,efficientnet_b0,64,0.19971689165954998,224,1.1919481947918725e-05,sgd,cosine,8.771380343280564e-06,PRUNED
8,0.9167167544364929,2026-08-01 02:46:58.659382,2026-08-01 02:52:57.487194,0 days 00:05:58.827812,convnext_tiny,64,0.31573689676626027,224,0.006153085601625313,sgd,cosine,0.0002576417442523316,COMPLETE
9,0.06352605670690536,2026-08-01 02:52:57.506414,2026-08-01 02:53:29.382341,0 days 00:00:31.875927,convnext_tiny,16,0.2350460685614512,192,0.00284475125551182,adamw,cosine,1.7874463256238412e-05,PRUNED
10,0.9235393404960632,2026-08-01 02:53:29.399243,2026-08-01 02:58:55.226992,0 days 00:05:25.827749,resnet50,16,0.4904657594472412,224,0.00028284230694934246,adamw,cosine,1.053517994552274e-06,COMPLETE
11,0.9381904602050781,2026-08-01 02:58:55.245810,2026-08-01 03:04:21.578748,0 days 00:05:26.332938,resnet50,16,0.4870617333067502,224,0.00024162626701440854,adamw,cosine,1.0254901368331829e-06,COMPLETE
12,0.9199724197387695,2026-08-01 03:04:21.601384,2026-08-01 03:09:47.898134,0 days 00:05:26.296750,resnet50,16,0.48563547446139954,224,0.00017300521597318882,adamw,cosine,3.0210752570094987e-06,COMPLETE
13,0.8639670610427856,2026-08-01 03:09:47.918906,2026-08-01 03:15:12.481945,0 days 00:05:24.563039,resnet50,16,0.407475950418773,224,0.0009455155883599507,adamw,cosine,3.1928253051975835e-06,COMPLETE
14,0.9280082583427429,2026-08-01 03:15:12.502682,2026-08-01 03:20:34.968196,0 days 00:05:22.465514,resnet50,16,0.34766715096163703,224,7.440435161481891e-05,adamw,cosine,3.760443676895836e-06,COMPLETE
15,0.9229650497436523,2026-08-01 03:20:34.989059,2026-08-01 03:26:02.863159,0 days 00:05:27.874100,resnet50,16,0.451845570690605,224,0.0002483149777527276,adamw,cosine,1.04692649077366e-06,COMPLETE
16,0.9079704284667969,2026-08-01 03:26:02.883409,2026-08-01 03:30:16.109305,0 days 00:04:13.225896,efficientnet_b0,32,0.35056421091376716,192,0.0006227253081323598,adamw,cosine,3.6259568472211903e-06,COMPLETE
17,0.9240134954452515,2026-08-01 03:30:16.129668,2026-08-01 03:35:46.171653,0 days 00:05:30.041985,resnet50,16,0.4471070222167448,224,9.015025681230772e-05,adamw,cosine,3.919937955659834e-05,COMPLETE
18,0.7080932855606079,2026-08-01 03:35:46.190600,2026-08-01 03:36:19.344782,0 days 00:00:33.154182,resnet50,16,0.4978922568894497,224,4.8227748329288826e-05,adamw,cosine,4.870107762232093e-05,PRUNED
19,0.9305235147476196,2026-08-01 03:36:19.361130,2026-08-01 03:40:58.110015,0 days 00:04:38.748885,resnet50,16,0.30299670565574266,192,0.00039714522026993744,adamw,cosine,1.9622051544137628e-06,COMPLETE
20,0.8961492776870728,2026-08-01 03:40:58.129935,2026-08-01 03:42:40.813100,0 days 00:01:42.683165,efficientnet_b0,32,0.4500314956897519,224,0.0013156804871643482,adamw,cosine,7.053476933446744e-06,PRUNED
21,0.9289857745170593,2026-08-01 03:42:40.830642,2026-08-01 03:47:19.337455,0 days 00:04:38.506813,resnet50,16,0.27003046607458187,192,0.0003559329076615594,adamw,cosine,2.0028662872767186e-06,COMPLETE
22,0.9168810844421387,2026-08-01 03:47:19.355567,2026-08-01 03:51:51.755883,0 days 00:04:32.400316,resnet50,16,0.38353190494749323,192,0.0001587484163266965,adamw,cosine,2.0074174243911447e-06,COMPLETE
23,0.8490731120109558,2026-08-01 03:51:51.774066,2026-08-01 03:52:37.175414,0 days 00:00:45.401348,resnet50,16,0.291302504262048,192,0.0004741359981371719,adamw,cosine,5.50339429345267e-06,PRUNED
24,0.9199655652046204,2026-08-01 03:52:37.190818,2026-08-01 03:57:12.041818,0 days 00:04:34.851000,resnet50,16,0.3385713409544604,192,0.00019275860337939076,adamw,cosine,1.7173209450788619e-06,COMPLETE
25,0.9215875864028931,2026-08-01 03:57:12.062823,2026-08-01 04:01:48.903792,0 days 00:04:36.840969,resnet50,16,0.41787061345774146,192,0.0001285815459950846,adamw,cosine,1.0573636672658295e-06,COMPLETE
26,0.7086886763572693,2026-08-01 04:01:48.923067,2026-08-01 04:02:22.076690,0 days 00:00:33.153623,resnet50,16,0.4623021829683753,224,4.505353338644292e-05,adamw,cosine,5.254497482632249e-06,PRUNED
27,0.8088408708572388,2026-08-01 04:02:22.103894,2026-08-01 04:02:55.083504,0 days 00:00:32.979610,resnet50,16,0.10564668368374322,224,0.0010098378149062575,adamw,cosine,2.2197700959001618e-06,PRUNED
28,0.9424102902412415,2026-08-01 04:02:55.108385,2026-08-01 04:07:48.373134,0 days 00:04:53.264749,efficientnet_b0,32,0.38225319610701863,256,0.0004456250818980064,adamw,cosine,1.1233255368686069e-05,COMPLETE
29,0.5488831996917725,2026-08-01 04:07:48.397536,2026-08-01 04:08:17.341314,0 days 00:00:28.943778,efficientnet_b0,32,0.38281010011416183,256,3.080361052726725e-05,adamw,cosine,3.267049197109421e-05,PRUNED
